{
  "authors": [
    "Aerospace Corporation"
  ],
  "category": "SCOR",
  "description": "SPARTA Techniques cluster derived from Aerospace Corporationâ€™s SPARTA STIX feed. Provides structured space threat technique taxonomy mapped to SPARTA tactics.",
  "name": "SCOR SPARTA Techniques",
  "source": "https://sparta.aerospace.org/",
  "type": "scor-sparta-techniques",
  "uuid": "a1a7fcd0-d48e-4b07-a11b-49c478e50fc8",
  "values": [
    {
      "description": "Adversary collects publicly available or signal-based information about space systems, ground stations, or mission elements to prepare operations.",
      "meta": {
        "external_id": "SPARTA-T001",
        "references": [
          "https://sparta.aerospace.org/techniques/T001"
        ],
        "tactic": [
          "Reconnaissance"
        ]
      },
      "uuid": "d478d31e-71a1-4bb2-9298-cff5fc2cfb70",
      "value": "Reconnaissance of Space Systems"
    },
    {
      "description": "Enumerating mission components, infrastructure, or space assets to identify weak points in communications, telemetry, or control planes.",
      "meta": {
        "external_id": "SPARTA-T002",
        "references": [
          "https://sparta.aerospace.org/techniques/T002"
        ],
        "tactic": [
          "Reconnaissance"
        ]
      },
      "uuid": "e5b5723c-0cc7-4d92-b83a-460e66f3a13b",
      "value": "Target Listing and Enumeration"
    },
    {
      "description": "Compromise or manipulation of suppliers, integrators, or logistics pathways for space system components prior to deployment.",
      "meta": {
        "external_id": "SPARTA-T015",
        "references": [
          "https://sparta.aerospace.org/techniques/T015"
        ],
        "tactic": [
          "Resource Development",
          "Initial Access"
        ]
      },
      "uuid": "7d3f4a7b-f3f1-49ae-8706-0c50e8e70e45",
      "value": "Supply Chain Compromise"
    },
    {
      "description": "Targeting and breaching ground infrastructure supporting space assets, including TT&C facilities, to enable command manipulation or denial of service.",
      "meta": {
        "external_id": "SPARTA-T021",
        "references": [
          "https://sparta.aerospace.org/techniques/T021"
        ],
        "tactic": [
          "Initial Access",
          "Execution"
        ]
      },
      "uuid": "a1e5ab50-0973-4cc0-84a7-b2b91a1c09bb",
      "value": "Ground Station Compromise"
    },
    {
      "description": "Using a co-orbital or inspector satellite to approach, collect data from, or disrupt a target satellite in orbit.",
      "meta": {
        "external_id": "SPARTA-T028",
        "references": [
          "https://sparta.aerospace.org/techniques/T028"
        ],
        "tactic": [
          "Execution",
          "Impact"
        ]
      },
      "uuid": "ef87bc37-63c6-4a87-b207-8f2ed4ac36e0",
      "value": "On-Orbit Proximity Operations"
    },
    {
      "description": "Interfering with TT&C, payload, or navigation links through targeted jamming of RF or optical channels.",
      "meta": {
        "external_id": "SPARTA-T033",
        "references": [
          "https://sparta.aerospace.org/techniques/T033"
        ],
        "tactic": [
          "Impact"
        ]
      },
      "uuid": "cbf0d2d0-1b31-4a8c-9a6d-23a7f7ce7b02",
      "value": "Signal Jamming"
    },
    {
      "description": "Crafting and transmitting malicious or spoofed signals to deceive space or ground segment systems, often mimicking trusted command paths.",
      "meta": {
        "external_id": "SPARTA-T035",
        "references": [
          "https://sparta.aerospace.org/techniques/T035"
        ],
        "tactic": [
          "Execution",
          "Impact"
        ]
      },
      "uuid": "6f7d337e-12a8-459d-9f2d-037889e7af25",
      "value": "Spoofing and Injection"
    },
    {
      "description": "Taking unauthorized control of a satellite payload to disrupt mission or re-task the asset for adversarial objectives.",
      "meta": {
        "external_id": "SPARTA-T041",
        "references": [
          "https://sparta.aerospace.org/techniques/T041"
        ],
        "tactic": [
          "Privilege Escalation",
          "Impact"
        ]
      },
      "uuid": "2b1f8cd8-3aaf-4c5e-82ef-b1b20b9ad0ae",
      "value": "Payload Hijack"
    },
    {
      "description": "Establishing a persistent or covert command-and-control channel to control compromised space or ground assets.",
      "meta": {
        "external_id": "SPARTA-T046",
        "references": [
          "https://sparta.aerospace.org/techniques/T046"
        ],
        "tactic": [
          "Command and Control"
        ]
      },
      "uuid": "d76cfdcb-7f4e-4f8e-beb1-1b0caa3dc9cc",
      "value": "Command and Control Channel Establishment"
    },
    {
      "description": "Extracting telemetry or payload data covertly or overtly to degrade confidentiality or enable follow-on operations.",
      "meta": {
        "external_id": "SPARTA-T051",
        "references": [
          "https://sparta.aerospace.org/techniques/T051"
        ],
        "tactic": [
          "Exfiltration",
          "Collection"
        ]
      },
      "uuid": "5d704087-69ae-4fcf-8a4d-4f798d07e5f3",
      "value": "Telemetry Exfiltration"
    },
    {
      "description": "Deliberately causing mission degradation or loss of service availability through cyber or physical attack vectors.",
      "meta": {
        "external_id": "SPARTA-T060",
        "references": [
          "https://sparta.aerospace.org/techniques/T060"
        ],
        "tactic": [
          "Impact"
        ]
      },
      "uuid": "f4492215-8820-4ac6-9ba7-10fd0d8fc7db",
      "value": "Service Denial"
    }
  ],
  "version": 1
}
