{
  "authors": [
    "Aerospace Corporation"
  ],
  "category": "SCOR",
  "description": "SPARTA Mitigations cluster derived from The Aerospace Corporationâ€™s SPARTA framework. Provides structured defensive measures against tactics and techniques used in space operations.",
  "name": "SCOR SPARTA Mitigations",
  "source": "https://sparta.aerospace.org/",
  "type": "scor-sparta-mitigations",
  "uuid": "ebe99984-0c3d-4767-8f0f-60e42e58043e",
  "values": [
    {
      "description": "Restrict access to space segment and ground segment systems through authentication and authorization controls.",
      "meta": {
        "external_id": "SPARTA-M001",
        "references": [
          "https://sparta.aerospace.org/mitigations/M001"
        ]
      },
      "uuid": "f64f7b5b-6a69-4b1b-a37f-b4a878d9277b",
      "value": "Access Control Enforcement"
    },
    {
      "description": "Require multi-factor authentication for operational control systems, mission management interfaces, and remote access points.",
      "meta": {
        "external_id": "SPARTA-M002",
        "references": [
          "https://sparta.aerospace.org/mitigations/M002"
        ]
      },
      "uuid": "42367b16-3a38-4b6c-83db-d796d453ccf5",
      "value": "Multi-Factor Authentication"
    },
    {
      "description": "Protect TT&C, payload, and inter-satellite communications with strong cryptographic protocols to reduce risk of interception and injection.",
      "meta": {
        "external_id": "SPARTA-M003",
        "references": [
          "https://sparta.aerospace.org/mitigations/M003"
        ]
      },
      "uuid": "1ccf8b67-bb43-4aeb-b8ea-f7d8e4db3d8d",
      "value": "Encryption of Communications"
    },
    {
      "description": "Authenticate uplink signals to prevent spoofing and unauthorized command injection.",
      "meta": {
        "external_id": "SPARTA-M004",
        "references": [
          "https://sparta.aerospace.org/mitigations/M004"
        ]
      },
      "uuid": "aa51e6f4-3fa2-4c6f-bb8a-0d4ee90569d6",
      "value": "Signal Authentication"
    },
    {
      "description": "Establish secure key management processes for TT&C and payload encryption, including key rotation and compromise response.",
      "meta": {
        "external_id": "SPARTA-M005",
        "references": [
          "https://sparta.aerospace.org/mitigations/M005"
        ]
      },
      "uuid": "891b34a6-5d65-4b39-bb9f-bd2a0cb8b779",
      "value": "Secure Key Management"
    },
    {
      "description": "Verify software integrity using code signing, checksums, and secure boot processes to prevent execution of malicious or altered software.",
      "meta": {
        "external_id": "SPARTA-M006",
        "references": [
          "https://sparta.aerospace.org/mitigations/M006"
        ]
      },
      "uuid": "d28bc3b8-d7e2-42a0-a777-03a2cc8b71fb",
      "value": "Software Integrity Verification"
    },
    {
      "description": "Isolate mission-critical systems, including TT&C, from enterprise networks or public interfaces to limit lateral movement.",
      "meta": {
        "external_id": "SPARTA-M007",
        "references": [
          "https://sparta.aerospace.org/mitigations/M007"
        ]
      },
      "uuid": "b05d1427-1643-4dcf-bae1-7136d4be5e56",
      "value": "Segmentation and Isolation"
    },
    {
      "description": "Detect and respond to RF or optical jamming attempts using monitoring and signal integrity checks.",
      "meta": {
        "external_id": "SPARTA-M008",
        "references": [
          "https://sparta.aerospace.org/mitigations/M008"
        ]
      },
      "uuid": "4b2a1bc5-ec72-4ecb-b8a2-0c62bca02106",
      "value": "Jamming and Interference Detection"
    },
    {
      "description": "Implement redundancy and failover mechanisms at the spacecraft and ground station level to maintain mission capability under attack.",
      "meta": {
        "external_id": "SPARTA-M009",
        "references": [
          "https://sparta.aerospace.org/mitigations/M009"
        ]
      },
      "uuid": "3185dc85-2d3d-41a8-9377-30a22a7b0b34",
      "value": "Redundancy and Resilience Engineering"
    },
    {
      "description": "Deploy anomaly detection systems to identify suspicious telemetry patterns, uplink anomalies, or unexpected system behavior.",
      "meta": {
        "external_id": "SPARTA-M010",
        "references": [
          "https://sparta.aerospace.org/mitigations/M010"
        ]
      },
      "uuid": "a733d1e2-6e64-4c8d-9ed0-21d54c99b89c",
      "value": "Monitoring and Anomaly Detection"
    },
    {
      "description": "Enforce supply chain security practices for spacecraft components, ensuring traceability, verification, and tamper resistance.",
      "meta": {
        "external_id": "SPARTA-M011",
        "references": [
          "https://sparta.aerospace.org/mitigations/M011"
        ]
      },
      "uuid": "0a5a3e0e-2d10-48a7-8cc0-5aa788c63d92",
      "value": "Secure Supply Chain Assurance"
    },
    {
      "description": "Develop and test incident response playbooks specific to space operations, including contingency uplink, safe-mode, and key rotation procedures.",
      "meta": {
        "external_id": "SPARTA-M012",
        "references": [
          "https://sparta.aerospace.org/mitigations/M012"
        ]
      },
      "uuid": "cc015e67-62dd-4824-b1f8-44eae7838ae0",
      "value": "Incident Response and Recovery Procedures"
    }
  ],
  "version": 1
}
