{
  "authors": [
    "Aerospace Corporation"
  ],
  "category": "SCOR",
  "description": "SPARTA Tactics cluster derived from Aerospace Corporationâ€™s SPARTA framework. These represent the adversary's tactical objectives in space attack campaigns.",
  "name": "SCOR SPARTA Tactics",
  "source": "https://sparta.aerospace.org/",
  "type": "scor-sparta-tactics",
  "uuid": "f7c90ea8-9cb3-43c5-9400-99c84e5854e4",
  "values": [
    {
      "description": "Adversary gathers information about the target space system to support follow-on operations.",
      "meta": {
        "external_id": "SPARTA-TA001",
        "references": [
          "https://sparta.aerospace.org/tactics/TA001"
        ]
      },
      "uuid": "acfd3e5a-46ad-4458-b71b-6c7c95f2ee09",
      "value": "Reconnaissance"
    },
    {
      "description": "Adversary establishes and prepares resources to support future space attack operations.",
      "meta": {
        "external_id": "SPARTA-TA002",
        "references": [
          "https://sparta.aerospace.org/tactics/TA002"
        ]
      },
      "uuid": "6de70784-cf52-47b7-b41a-01d5107b8968",
      "value": "Resource Development"
    },
    {
      "description": "Adversary gains initial access to the target space or ground segment.",
      "meta": {
        "external_id": "SPARTA-TA003",
        "references": [
          "https://sparta.aerospace.org/tactics/TA003"
        ]
      },
      "uuid": "dd1c2d0a-73f6-40b8-9491-32c961da17ab",
      "value": "Initial Access"
    },
    {
      "description": "Adversary runs malicious code, commands, or payloads on the target system.",
      "meta": {
        "external_id": "SPARTA-TA004",
        "references": [
          "https://sparta.aerospace.org/tactics/TA004"
        ]
      },
      "uuid": "f4e12af8-8a7c-4bb8-b330-c86fa646c6b4",
      "value": "Execution"
    },
    {
      "description": "Adversary maintains access to the target environment after initial compromise.",
      "meta": {
        "external_id": "SPARTA-TA005",
        "references": [
          "https://sparta.aerospace.org/tactics/TA005"
        ]
      },
      "uuid": "f9630da3-2506-4a1e-9334-6a7603c9b94f",
      "value": "Persistence"
    },
    {
      "description": "Adversary gains higher-level permissions or control over target systems.",
      "meta": {
        "external_id": "SPARTA-TA006",
        "references": [
          "https://sparta.aerospace.org/tactics/TA006"
        ]
      },
      "uuid": "16de73ab-0f25-4e56-93cf-f1b9eeec2a33",
      "value": "Privilege Escalation"
    },
    {
      "description": "Adversary avoids detection or neutralizes defensive mechanisms.",
      "meta": {
        "external_id": "SPARTA-TA007",
        "references": [
          "https://sparta.aerospace.org/tactics/TA007"
        ]
      },
      "uuid": "2ee00736-4d8a-4cd8-8787-42b46f7f1e25",
      "value": "Defense Evasion"
    },
    {
      "description": "Adversary attempts to obtain access credentials for systems and services.",
      "meta": {
        "external_id": "SPARTA-TA008",
        "references": [
          "https://sparta.aerospace.org/tactics/TA008"
        ]
      },
      "uuid": "59d78a9a-9d3b-4b4f-bf7c-dc439c748b31",
      "value": "Credential Access"
    },
    {
      "description": "Adversary gathers knowledge about the internal environment post-compromise.",
      "meta": {
        "external_id": "SPARTA-TA009",
        "references": [
          "https://sparta.aerospace.org/tactics/TA009"
        ]
      },
      "uuid": "be0cd6e3-4b2f-45e3-835e-1e0d38bc3a31",
      "value": "Discovery"
    },
    {
      "description": "Adversary moves between systems or subsystems to gain additional control or access.",
      "meta": {
        "external_id": "SPARTA-TA010",
        "references": [
          "https://sparta.aerospace.org/tactics/TA010"
        ]
      },
      "uuid": "5de519e1-c9dd-4032-b252-98295ef234a5",
      "value": "Lateral Movement"
    },
    {
      "description": "Adversary gathers data of interest from the target environment.",
      "meta": {
        "external_id": "SPARTA-TA011",
        "references": [
          "https://sparta.aerospace.org/tactics/TA011"
        ]
      },
      "uuid": "a4b7c702-b77a-4d6f-8c9b-270a7e0e7f25",
      "value": "Collection"
    },
    {
      "description": "Adversary establishes control channels to maintain and direct operations.",
      "meta": {
        "external_id": "SPARTA-TA012",
        "references": [
          "https://sparta.aerospace.org/tactics/TA012"
        ]
      },
      "uuid": "0bc2361b-f0f3-420d-8083-3b640bd6eea2",
      "value": "Command and Control"
    },
    {
      "description": "Adversary steals data from the target system.",
      "meta": {
        "external_id": "SPARTA-TA013",
        "references": [
          "https://sparta.aerospace.org/tactics/TA013"
        ]
      },
      "uuid": "723a7791-9dc8-4d58-b5cc-2f86457d9739",
      "value": "Exfiltration"
    },
    {
      "description": "Adversary manipulates, disrupts, or destroys system functionality or data.",
      "meta": {
        "external_id": "SPARTA-TA014",
        "references": [
          "https://sparta.aerospace.org/tactics/TA014"
        ]
      },
      "uuid": "0bafc6f6-009b-4268-b8ed-c5c6df4f9e6c",
      "value": "Impact"
    }
  ],
  "version": 1
}
