{
  "authors": [
    "The Aerospace Corporation"
  ],
  "category": "tool",
  "description": "SPARTA tactics published by The Aerospace Corporation.",
  "name": "SPARTA Tactics",
  "source": "https://sparta.aerospace.org/",
  "type": "sparta-tactics",
  "uuid": "a60fa448-8928-56bc-b676-2c33b664a8fb",
  "values": [
    {
      "meta": {
        "shortname": "defense-evasion"
      },
      "uuid": "ed1f0314-6ac0-5cc9-a04b-78340f543128",
      "value": "Defense Evasion"
    },
    {
      "meta": {
        "shortname": "execution"
      },
      "uuid": "5ddf92c0-bae7-5b85-8d0c-e0038ec2abb3",
      "value": "Execution"
    },
    {
      "meta": {
        "shortname": "exfiltration"
      },
      "uuid": "1dd213a0-ce05-59d4-8972-dfc6ee3bc565",
      "value": "Exfiltration"
    },
    {
      "meta": {
        "shortname": "impact"
      },
      "uuid": "ece83503-686e-56e5-ab91-e9fd65be8b46",
      "value": "Impact"
    },
    {
      "meta": {
        "shortname": "initial-access"
      },
      "uuid": "e4fe9c89-2255-56cf-b8d3-2cdd08e7c952",
      "value": "Initial Access"
    },
    {
      "meta": {
        "shortname": "lateral-movement"
      },
      "uuid": "dd4b8233-d428-5b6b-a418-f948dd210aa3",
      "value": "Lateral Movement"
    },
    {
      "meta": {
        "shortname": "persistence"
      },
      "uuid": "79dab32f-04d8-51ac-b1ce-eb663d10e5a4",
      "value": "Persistence"
    },
    {
      "meta": {
        "shortname": "reconnaissance"
      },
      "uuid": "20eab5d2-8ba3-5ca3-b2f6-a200bfa7283a",
      "value": "Reconnaissance"
    },
    {
      "meta": {
        "shortname": "resource-development"
      },
      "uuid": "0203fdd0-bae2-590d-80c5-5bbcc69eb98e",
      "value": "Resource Development"
    }
  ],
  "version": 1
}
