{
  "authors": [
    "H4CK32N4U75®"
  ],
  "category": "exposure-domain",
  "description": "Five exposure domains that classify how an event reaches the platform: Kinetic, Non-kinetic, Electronic Warfare (EW), Cyber Warfare, and Other (environmental). Applied orthogonally to the SCOR five-layer schema (PCE, SEG, SVC, AST, AN).",
  "name": "SCOR Exposure Domain",
  "source": "Project documentation",
  "type": "scor-exposure-domain",
  "uuid": "5e3c1d8a-2b4f-4c6e-9a1b-0c2d3e4f5a02",
  "values": [
    {
      "description": "Physical destruction or degradation of platform elements by direct-ascent anti-satellite weapons, co-orbital interceptors, or surface-to-surface attacks on ground infrastructure.",
      "meta": {
        "short_name": "Kinetic"
      },
      "uuid": "5e3c1d8a-2b4f-4c6e-9a1b-000000000001",
      "value": "Kinetic"
    },
    {
      "description": "Directed energy (laser, microwave), high-altitude electromagnetic pulse, and other effects that degrade or destroy platform elements without physical contact.",
      "meta": {
        "short_name": "Non-kinetic"
      },
      "uuid": "5e3c1d8a-2b4f-4c6e-9a1b-000000000002",
      "value": "Non-kinetic"
    },
    {
      "description": "Interference with the radio frequency environment: jamming, spoofing, meaconing, and protocol-layer manipulation of signals and links.",
      "meta": {
        "short_name": "EW"
      },
      "uuid": "5e3c1d8a-2b4f-4c6e-9a1b-000000000003",
      "value": "Electronic Warfare (EW)"
    },
    {
      "description": "Intrusion into and manipulation of the digital elements of the platform, including ground infrastructure, flight software, firmware, data streams, and supply chain dependencies.",
      "meta": {
        "short_name": "Cyber"
      },
      "uuid": "5e3c1d8a-2b4f-4c6e-9a1b-000000000004",
      "value": "Cyber Warfare"
    },
    {
      "description": "Space weather, orbital debris, atmospheric effects, and other non-adversary hazards that share characteristics with deliberate attacks and must be discriminated from them during analysis.",
      "meta": {
        "short_name": "Environmental"
      },
      "uuid": "5e3c1d8a-2b4f-4c6e-9a1b-000000000005",
      "value": "Other (environmental)"
    }
  ],
  "version": 1
}
