{
  "authors": [
    "Vasilis Katos",
    "Jane Henriksen-Bulmer",
    "Emily Rosenorn-Lanng",
    "Ala Yankouskaya"
  ],
  "category": "humint",
  "description": "Human Layer Kill Chain (HKC) framework",
  "name": "Human Layer Kill Chain",
  "source": "https://arxiv.org/pdf/2505.24685",
  "type": "human-layer-kill-chain",
  "uuid": "64a9dcad-93f4-4d95-b7f4-e808a727b20d",
  "values": [
    {
      "description": "Research dating platforms and identify vulnerable profiles",
      "meta": {
        "kill_chain": [
          "human-layer-kill-chain:Target profiling"
        ]
      },
      "uuid": "7c2a19e5-9c1e-4d78-9c49-939f40092e5c",
      "value": "Research dating platforms and identify vulnerable profiles"
    },
    {
      "description": "Identify low value target/employee",
      "meta": {
        "kill_chain": [
          "human-layer-kill-chain:Target profiling"
        ]
      },
      "uuid": "1c99c4c9-5d88-44bd-bae3-288099d496e6",
      "value": "Identify low value target/employee"
    },
    {
      "description": "Analyse emotional vulnerabilities (recent loss, loneliness)",
      "meta": {
        "kill_chain": [
          "human-layer-kill-chain:Human vulnerability assessment"
        ]
      },
      "uuid": "25a8f3a2-7e72-4da0-b4c6-4253deb13a01",
      "value": "Analyse emotional vulnerabilities (recent loss, loneliness)"
    },
    {
      "description": "Profile executives",
      "meta": {
        "kill_chain": [
          "human-layer-kill-chain:Human vulnerability assessment"
        ]
      },
      "uuid": "33376a7e-ceda-4308-be88-52718064e5bd",
      "value": "Profile executives"
    },
    {
      "description": "Create attractive fake profiles with stolen/deepfake photos",
      "meta": {
        "kill_chain": [
          "human-layer-kill-chain:Personalized attack design"
        ]
      },
      "uuid": "6afd9f0a-a67b-48dc-9354-a7a11b8512c4",
      "value": "Create attractive fake profiles with stolen/deepfake photos"
    },
    {
      "description": "Create spoofed email",
      "meta": {
        "kill_chain": [
          "human-layer-kill-chain:Personalized attack design"
        ]
      },
      "uuid": "f3f738d4-dc7a-4bbc-8815-2a6b39e8cbf3",
      "value": "Create spoofed email"
    },
    {
      "description": "Initial contact and emotional connection",
      "meta": {
        "kill_chain": [
          "human-layer-kill-chain:Trust establishment"
        ]
      },
      "uuid": "afc9dbeb-7ab3-4ea9-849c-0a73dad1c05d",
      "value": "Initial contact and emotional connection"
    },
    {
      "description": "Establish legitimacy",
      "meta": {
        "kill_chain": [
          "human-layer-kill-chain:Trust establishment"
        ]
      },
      "uuid": "db1baa9a-7faf-4afe-a898-db02d5c17b94",
      "value": "Establish legitimacy"
    },
    {
      "description": "Send email",
      "meta": {
        "kill_chain": [
          "human-layer-kill-chain:Trust establishment"
        ]
      },
      "uuid": "7db56596-8d61-4196-98c4-2fef88555c6c",
      "value": "Send email"
    },
    {
      "description": "Deploy urgency payment request",
      "meta": {
        "kill_chain": [
          "human-layer-kill-chain:Emotional triggering"
        ]
      },
      "uuid": "24149736-fd49-4a9e-aab8-e93013fe939c",
      "value": "Deploy urgency payment request"
    },
    {
      "description": "Deliver ransomware note",
      "meta": {
        "kill_chain": [
          "human-layer-kill-chain:Emotional triggering"
        ]
      },
      "uuid": "7e173d0d-ef04-4345-977d-9fb15079a328",
      "value": "Deliver ransomware note"
    },
    {
      "description": "Build deep emotional dependency",
      "meta": {
        "kill_chain": [
          "human-layer-kill-chain:Sustained engagement"
        ]
      },
      "uuid": "74ff62cf-fa4a-4265-8847-08d1c7624878",
      "value": "Build deep emotional dependency"
    },
    {
      "description": "Payment negotiation",
      "meta": {
        "kill_chain": [
          "human-layer-kill-chain:Sustained engagement"
        ]
      },
      "uuid": "b3cc3e08-f0d8-4f15-bcce-97ea6fb0fc5a",
      "value": "Payment negotiation"
    },
    {
      "description": "Crypto payment support",
      "meta": {
        "kill_chain": [
          "human-layer-kill-chain:Sustained engagement"
        ]
      },
      "uuid": "8ac30497-c778-4e68-8608-0ac6d74de2e6",
      "value": "Crypto payment support"
    },
    {
      "description": "Request financial help with fabricated emergency",
      "meta": {
        "kill_chain": [
          "human-layer-kill-chain:Action Manipulation"
        ]
      },
      "uuid": "029ca7f8-b94b-4896-b1c4-f3729636c2d3",
      "value": "Request financial help with fabricated emergency"
    },
    {
      "description": "Execute fund transfer",
      "meta": {
        "kill_chain": [
          "human-layer-kill-chain:Action Manipulation"
        ]
      },
      "uuid": "d49f9515-3244-412f-9da7-f1f3447a10d7",
      "value": "Execute fund transfer"
    },
    {
      "description": "Delete profile and online presence",
      "meta": {
        "kill_chain": [
          "human-layer-kill-chain:Operational Cleanup"
        ]
      },
      "uuid": "6e72d1bc-e746-4331-b120-12572361fc2f",
      "value": "Delete profile and online presence"
    }
  ],
  "version": 2
}
